claim_id,phase,status,lean_module,certificate,frozen_object,candidate_rule,admissibility_class,uniqueness_witness,counterexample_witness,spectral_obstruction,exact_missing_primitive,downstream_gate
D0-VNEXT-AF-ONE-DIMENSIONAL-REDUCTION-CLASSIFICATION-001,A,NO-GO,D0.VNext.AFOneDimensionalReductionClassification,vp_vnext_af_one_dimensional_reduction_classification.py,"A_3=M_5(+)M_3 (blocks 5,3); scene parts (9,11,13)",trace=cyclic line C*1,invariant-definable lines,trace line canonical (unique trace-canonical),"reduced (24,8,1) != scene (9,11,13); 2 blocks != 3 parts",,no scene-structure-preserving reduction (Outcome D),none
D0-VNEXT-AF-D0-SPECTRAL-COMPRESSION-OWNER-001,D,NO-GO,D0.VNext.AFD0SpectralInvariantComparison,vp_vnext_af_d0_spectral_invariant_comparison.py,"scene Laplacian {0:1,20:12,22:10,24:8,33:2}; AF martingale increments",unitary Xi must preserve multiplicities,spectral invariants,,"AF reduced mults {1,3,8,21} != scene {1,2,8,10,12}; 4!=5 distinct","mult-multiset {1,3,8,21} != {1,2,8,10,12} (scale-independent)",none (decisive obstruction),none
D0-VNEXT-CANONICAL-XI-ANCHOR-OWNER-001,B,NO-GO,D0.VNext.AFOneDimensionalReductionClassification,vp_vnext_canonical_xi_anchor.py,"AF reduced (24,8,1); scene (9,11,13)",scene-encoding chi,computable invariant encoding,,"no canonical chi: (24,8,1) from 2 blocks vs (9,11,13) from 3 parts",dimension-only Xi ruled out by spectral obstruction,PRIM-COMPARISON-MAP-XI-N (remains independent; not derived),none
D0-VNEXT-JOINT-DIRAC-SCALE-SELECTION-OWNER-001,C,NO-GO,D0.VNext.AFD0SpectralInvariantComparison,vp_vnext_joint_dirac_scale_selection.py,AF martingale Dirac scale family,anchored spectral matching,Perron/refinement-covariant scales,,no canonical Xi -> no anchored matching condition,scale sets eigenvalues not multiplicities,PRIM-DIRAC-SCALE-SELECTION (remains independent; not co-selected),none
D0-VNEXT-AF-D0-FESHBACH-COMPRESSION-OWNER-001,E,CERT-CLOSED,,vp_vnext_scene_feshbach_compression_owner.py,"P_N,Q_N,F_N; Aut-invariant zone/archive split",W_eff(0)=A_bb-(1/20)BB^T (z=0 Schur; sample-z object),canonical Schur split,Aut-orbit zone split (false-twins + distinct degrees {24;22;20}),equal-part K(11;11;11) drops no eigenvalue (obstruction scene-specific),5->4 distinct-eigenvalue reduction (unitary-impossible),none (Xi not needed: projection split not unitary intertwiner),none
D0-VNEXT-33-SCENE-ANCHOR-OWNER-001,master,NO-GO,D0.VNext.AFD0SpectralInvariantComparison,vp_vnext_af_d0_spectral_invariant_comparison.py,Fibonacci AF + frozen D0 scene,one-dim reduction -> quotient -> Xi,minimal structural extension,,Outcome D (structure) + Phase-D spectral obstruction,mult-multiset mismatch,PRIM-CANONICAL-33-SCENE-ANCHOR does NOT exist,none
D0-VNEXT-33-SCENE-ANCHOR-NOGO-001,master,NO-GO,D0.VNext.AFD0SpectralInvariantComparison,vp_vnext_af_d0_spectral_invariant_comparison.py,34-to-33 coincidence,canonical 33-scene anchor,,,typed coincidence (algebra dim vs vertex count); double obstruction,scale-independent spectral mismatch,the anchor is not constructible from present admissible finite data,none
D0-VNEXT-JOINT-DIRAC-ANCHOR-NOGO-001,F,NO-GO,D0.VNext.AFD0SpectralInvariantComparison,vp_vnext33_no_overclaim.py,PRIM-DIRAC-SCALE-SELECTION; PRIM-COMPARISON-MAP-XI-N,unify via one anchor,,,no unifying anchor (D0-VNEXT-33-SCENE-ANCHOR-NOGO-001),,the two primitives remain INDEPENDENT (Phase F result 4),none
