assumption_id,lean_name,lean_file,used_by_theorem,claim_id,assumption_type,status,justification,external_source_or_cert,failure_meaning
ASSUMP-HURWITZ-GOLDEN,D0.Bridge.BridgeAssumption.GoldenBadlyApproximableAssumption,D0/Bridge/Assumptions/Hurwitz.lean,D0-PHI-HURWITZ-001,D0-PHI-HURWITZ-001,PHYSICS_DICTIONARY,EXPLICIT,"Full Hurwitz/golden worst-approximable theorem is not promoted to Core.",vp_v1142_hurwitz_phi_phase_rigidity.py,"Phase rigidity remains unpromoted beyond finite core lemmas."
ASSUMP-RG-SMOOTH-INTERP,D0.Bridge.BridgeAssumption.SmoothInterpolationAssumptions,D0/Bridge/Assumptions/SmoothInterpolation.lean,phi_rg_bridge_conditional,D0-RG-001,QFT_RG_BRIDGE,EXPLICIT,"Continuous RG shadow requires declared smooth interpolation and scheme data.",vp_v1145_operator_bridge_triple.py,"RG claim stays finite scale algebra only."
ASSUMP-LORENTZ-MACRO,D0.Bridge.BridgeAssumption.LorentzBridgeAssumptions,D0/Bridge/LorentzBridge.lean,lorentz_bridge_promoted,D0-CARRIER-003,MACRO_LIMIT,EXPLICIT,"Spin/Lorentz macro integration is conditional beyond finite Clifford matrices.",vp_v1145_operator_bridge_triple.py,"Carrier remains finite Clifford check, not macro Lorentz integration."
ASSUMP-SMOOTH-COVARIANCE,D0.Bridge.BridgeAssumption.CovarianceSystem,D0/Bridge/SmoothMetricBridge.lean,smooth_metric_bridge_conditional,D0-SMOOTH-001,SMOOTH_LIMIT,EXPLICIT,"Smooth metric bridge requires covariance compatibility and nondegeneracy.",vp_v1145_operator_bridge_triple.py,"Smooth macro geometry is not promoted."
ASSUMP-SMOOTH-HEATTRACE,D0.Bridge.BridgeAssumption.HeatTraceWeylAssumptions,D0/Bridge/Assumptions/HeatTraceWeyl.lean,smooth_metric_bridge_conditional,D0-SMOOTH-001,SMOOTH_LIMIT,EXPLICIT,"Heat trace convergence/Weyl asymptotics/signature are bridge hypotheses.",vp_v1145_operator_bridge_triple.py,"Smooth macro geometry is not promoted."
ASSUMP-HST-EXTERNAL,D0.Bridge.BridgeAssumption.ExternalHSTAssumptions,D0/Bridge/Assumptions/ExternalHST.lean,convex_response_bridge_conditional,D0-CONVEX-RESPONSE-BRIDGE,PHYSICS_DICTIONARY,EXPLICIT,"External HST theorem applicability is not a Lean core theorem.",,"Convex/HST bridge remains external."
ASSUMP-COMPACT-LIE-KILLING-NEGATIVE,D0.Bridge.BridgeAssumption.CompactLieKillingNegative,D0/Bridge/Assumptions/YangMillsKilling.lean,discreteYangMillsAction_nonnegative_of_killing_nonpos,D0-GAUGE-YANG-MILLS-KILLING-POSITIVITY-001,LIE_ALGEBRA_LIBRARY_GAP,EXPLICIT,"Compact Lie algebra Killing-form negative semidefiniteness is assumed rather than derived in the current Lean layer.",,"Yang-Mills positivity remains conditional on the declared Killing negativity hypothesis."
