passport_id,sector,core_owner,external_manifest,cert_or_runner,allowed_status,current_result_artifact,negative_controls,promotion_boundary,manifest_status,artifact_status
ICECUBE-PHAS1,IceCube neutrino decoherence,D0.Matter.NeutrinoPhasonWaves;D0.Passport.IceCubePhasonDecoherence,08_PASSPORTS/IceCube/icecube_manifest.json,05_CERTS/vp_neutrino_phason_decoherence_passport.py,EMPIRICAL_PASSPORT_OR_EXTERNAL_DATA_REQUIRED,08_PASSPORTS/IceCube/icecube_phason_decoherence_summary.json,empty manifest cannot run; detector-response tuning cannot retune kernel,IceCube data constrain the frozen phason-decoherence passport only.,READY,READY
SPARC-HALO1,SPARC halo response,D0.Cosmology.SDEFeedbackReduction;D0.Physics.ArchivePhasonDarkMatter,08_PASSPORTS/SPARC/sparc_manifest.json,05_CERTS/vp_archive_phason_halo_passport.py;05_CERTS/vp_sde_feedback_reduction.py,FAIL_DIAGNOSTIC_ALLOWED,08_PASSPORTS/SPARC/sparc_feedback_refinement_constraint.json,FAIL_ARCHIVE_PHASON_HALO_SPARC_SHAPE_ONLY;FAIL_ARCHIVE_PHASON_HALO_SPARC_ONE_GLOBAL_SCALE;FAIL_ARBITRARY_KERNEL_REPAIR,"SPARC failure may only select derived boundary-derivative feedback, not a fitted halo kernel.",READY,READY
DESI-SDE1,DESI BAO S_DE transfer,D0.Cosmology.PhasonFlipEntropy;D0.Cosmology.SDEFeedbackReduction,08_PASSPORTS/DESI/desi_dr2_manifest.json,05_CERTS/vp_bao_sde_phason_flip_passport.py;05_CERTS/vp_sde_feedback_reduction.py,FAIL_DIAGNOSTIC_ALLOWED,08_PASSPORTS/DESI/desi_feedback_refinement_constraint.json,FAIL_DESI_ROOT_REFIT_REPAIR;FAIL_DESI_WINDOW_REFIT_REPAIR;FAIL_ARBITRARY_KERNEL_REPAIR,DESI failure constrains boundary derivative of F_N; roots/windows/H0/Omega_m/rd are not refit.,READY,READY
CMB-PHASON1,Planck CMB phason-flip entropy,D0.Cosmology.PhasonFlipEntropy,08_PASSPORTS/PlanckCMB/planck_manifest.json,05_CERTS/vp_cmb_phason_flip_entropy_passport.py,EMPIRICAL_PASSPORT_OR_EXTERNAL_DATA_REQUIRED,08_PASSPORTS/PlanckCMB/planck_phason_flip_summary.json,LambdaCDM residual cannot choose the internal entropy operator,CMB comparison tests a frozen entropy-transfer observable only.,READY,READY
CKM-PDG1,CKM external convention,D0.Matter.CKMPhasonHolonomy;D0.Matter.CKMExactTransfer,08_PASSPORTS/CKM/ckm_manifest.json,05_CERTS/vp_ckm_holonomy_external_convention_passport.py,EMPIRICAL_PASSPORT_OR_CONVENTION_CHECK,08_PASSPORTS/CKM/ckm_holonomy_external_summary.json,PDG/RG comparison cannot mutate the frozen finite CKM matrix,"PDG CKM values are convention/readout comparison, not source of the finite holonomy.",READY,READY
MESON-PDG1,Meson PDG domain-wall comparison,D0.Matter.MesonPhasonDomainWalls,08_PASSPORTS/PDG_Meson/pdg_meson_manifest.json,05_CERTS/vp_meson_domain_wall_pdg_passport.py,EMPIRICAL_PASSPORT_OR_EXTERNAL_DATA_REQUIRED,08_PASSPORTS/PDG_Meson/pdg_meson_domain_wall_summary.json,PDG mass-width table cannot promote mass formula without transfer map,PDG comparison tests domain-wall class residuals only.,READY,READY
